code,name,nameTH,category,categoryTH,type,typeTH,credits,description,descriptionTH,prerequisite,remake,remarkTH
GE 2203,Art of Living,ศิลปะแห่งการใช้ชีวิต,General Education Courses,หมวดวิชาศึกษาทัวไป,Social Science Courses,กลุ่มวิชาสังคมศาสตร์,3 (3-0-6),"Self-exploration, understanding ways to improve self-esteem, analysing real-life problems, conflict and
stress, breaking bad habits, power of positive thinking, designing plans to live a happy life.","การค้นหาตัวตน ความเข้าใจวิธีการพัฒนาความรู้สึกเคารพและมัน􀃉 ใจในตัวเอง การวิเคราะห์ปัญหาในชีวิตจริง
ความขัดแย้ง และความเครียด การขจัดนิสัยไม่ดีในตัวเอง พลังของการคิดบวก การออกแบบแผนการใช้ชีวิต
อย่างมีความสุข",,,
GE 2205,Communication and Multicultural society,ทักษะการสื􀃉อสารและสังคมพหุวัฒนธรรม,General Education Courses,หมวดวิชาศึกษาทัวไป,Social Science Courses,กลุ่มวิชาสังคมศาสตร์,3 (3-0-6),"Communication skills, effective interaction with other people, human relationships in a multicultural
society, interpersonal intelligence, skills in learning and living with others","ทักษะการสื􀃉อสาร ปฏิสัมพันธ์ที􀃉มีประสิทธิภาพกับบุคคลอื􀃉น มนุษยสัมพันธ์ในสังคมที􀃉มีความหลากหลายด้าน
วัฒนธรรม ปัญญาด้านมนุษยสัมพันธ์ ทักษะในการเรียนและการใช้ชีวิตร่วมกับผู้อื􀃉น",,,
GE 2206,Personality Development,การพัฒนาบุคลิกภาพ,General Education Courses,หมวดวิชาศึกษาทัวไป,Social Science Courses,กลุ่มวิชาสังคมศาสตร์,3 (3-0-6),"mprovement of one’s self-confidence and self-esteem, think positively towards themselves, how to make
friends, international table manners, dressing up oneself to match one’s personality, keeping healthy,
applying makeup, public speaking, interpersonal relationship skills","การพัฒนาความมัน􀃉 ใจในตนเองและการรู้คุณค่าในตนเอง ทัศนคติเชิงบวกทีม􀃉 ีต่อตนเอง การสร้างความสัมพันธ์
ระหว่างเพื􀃉อน มารยาทในการรับประทานอาหารแบบสากล การแต่งกายให้เหมาะสมกับบุคลิกภาพของตนเอง
การดูแลรักษาสุขภาพของตัวเอง การแต่งหน้า การพูดในทีช􀃉 ุมชน ทักษะความสัมพันธ์ระหว่างบุคคล",,,
GE 2207,"Sport, Health and Wellness Development",กีฬา สุขภาพ และการพัฒนาคุณภาพชีวิต,General Education Courses,หมวดวิชาศึกษาทัวไป,Social Science Courses,กลุ่มวิชาสังคมศาสตร์,3 (3-0-6),"Knowledge and understanding of sports, exercise, health promotion and fitness, principle of sport
spectating, selection of sport activities, self-care for good health and wellness development","ความรู้ ความเข้าใจเกี􀃉ยวกับการเล่นกีฬา การออกกำลังกาย การส่งเสริมสุขภาพ และการเสริมสร้างสมรรถภาพ
ทางกาย หลักการดูกีฬา การเลือกกิจกรรมกีฬา การดูแลตนเองเพือ􀃉 สุขภาพทีด􀃉 ี และการพัฒนาสุขภาวะ",,,
GE 2208,Thai Politics and Government,การเมืองการปกครองไทย,General Education Courses,หมวดวิชาศึกษาทัวไป,Social Science Courses,กลุ่มวิชาสังคมศาสตร์,3 (3-0-6),"Thai politics from monarchy to democracy, political reforms, development of democracy, involvement of
civil and private sectors, election, political ethics","การเมืองไทยจากระบอบสมบูรณาญาสิทธิราชย์จนถึงระบอบประชาธิปไตย การปฏิรูปการเมืองไทย การพัฒนา
ระบอบประชาธิปไตย การมีส่วนร่วมของภาคประชาชนและภาคเอกชน การเลือกตัง􀃊 จริยธรรมทางการเมือง",,,
MGT 1101,Introduction to Business,ธุรกิจเบื􀃊องต้น,General Education Courses,หมวดวิชาศึกษาทัวไป,Social Science Courses,กลุ่มวิชาสังคมศาสตร์,3 (3-0-6),"General introduction to business, philosophy, objectives and responsibility of business enterprises,
business vocabulary, business and its environment emphasizing fundamental principles of organization,
legal forms of business ownership, business activities concerning personnel, accounting, marketing,
production and finance.","พื􀃊นฐานทัว􀃉 ไปทางธุรกิจ ปรัชญา จุดมุ่งหมาย และหน้าที􀃉ความรับผิดชอบขององค์กรธุรกิจ คำนิยามต่างๆ ทาง
ธุรกิจ ธุรกิจและสภาพแวดล้อมทางธุรกิจ หลักการพื􀃊นฐานในการจัดการองค์กร รูปแบบทางกฎหมายของการ
เป็นเจ้าของธุรกิจ กิจกรรมทางธุรกิจทีเ􀃉 กีย􀃉 วข้องกับบุคลากร การบัญชี การตลาด การผลิตและการเงิน",,,
ECO 2200,Introduction to Economics,เศรษฐศาสตร์เบื􀃊องต้น,General Education Courses,หมวดวิชาศึกษาทัวไป,Social Science Courses,กลุ่มวิชาสังคมศาสตร์,3 (3-0-6),"Economic concepts and theories in making decisions at individual, market, and aggregate levels focusing
on consumer decision, pricing mechanism, demand and supply analysis, market equilibrium, theory of
the firm, perfectly and imperfectly competitive market structures, national income accounts,
unemployment, inflation, and fiscal and monetary policies.","แนวคิดและทฤษฎีเศรษฐศาสตร์เพื􀃉อนำไปตัดสินใจในระดับปัจเจกชนระดับตลาด และระดับมวลรวม โดยเน้น
ด้านการตัดสินใจของผู้บริโภค กลไกราคา การวิเคราะห์อุปสงค์และอุปทาน ดุลยภาพของตลาด โครงสร้างของ
ตลาดแข่งขันสมบูรณ์และไม่สมบูรณ์ บัญชีรายได้ประชาชาติ การว่างงาน ภาวะเงินเฟ้อ นโยบายการคลัง และ
นโยบายการเงิน",,,
GE 1301,Environmental Science,วิทยาศาสตร์สิ􀃉งแวดล้อม,General Education Courses,หมวดวิชาศึกษาทัวไป,Science and Mathematics Courses,กลุ่มวิชาวิทยาศาสตร์และคณิตศาสตร์,3 (3-0-6),"General science, scientific approaches, understanding the interrelationships of the nature, identification
and analysis of environmental problems, application and alternative solutions for preventing and solving
environmental problems","วิทยาศาสตร์ทัว􀃉 ไป กระบวนการคิดทางวิทยาศาตร์ ความเข้าใจความสัมพันธ์ของธรรมชาติ การแยกแยะและ
วิเคราะห์ปัญหาสิ􀃉งแวดล้อม การประยุกต์ใช้และวิธีการแก้ปัญหาที􀃉หลากหลายเพื􀃉อป้องกันและแก้ปัญหา
สิ􀃉งแวดล้อม",,,
GE 2301,Lifestyles in Dynamic World,วิถีชีวิตในโลกที􀃉เปลี􀃉ยนแปลง,General Education Courses,หมวดวิชาศึกษาทัวไป,Science and Mathematics Courses,กลุ่มวิชาวิทยาศาสตร์และคณิตศาสตร์,3 (3-0-6),"Relationship between lifestyle choices and impacts of these choices on individual’s health and the global
environment, scientific approaches to nutrition, supplements, sleep, rest, exercise, and sexuality.
Evaluation of individual healthy and eco- friendly lifestyles.","ความสัมพันธ์ระหว่างผลกระทบของวิถีการเลือกใช้ชีวิตประจำวันต่อสุขภาพมนุษย์ และสภาพแวดล้อมของโลก
แนวทางวิทยาศาสตร์ต่อประเด็นด้านโภชนาการ อาหารเสริม การนอนหลับ การพักผ่อน การออกกำลังกายและ
เพศสัมพันธ์ การประเมินค่าในวิถีการใช้ชีวิตทีด􀃉 ีต่อสุขภาพและเป็นมิตรต่อสิง􀃉 แวดล้อม",,,
GE 2302,Climate Change and Human Life,การเปลี􀃉ยนแปลงสภาพภูมิอากาศโลกและชีวิตมนุษย์,General Education Courses,หมวดวิชาศึกษาทัวไป,Science and Mathematics Courses,กลุ่มวิชาวิทยาศาสตร์และคณิตศาสตร์,3 (3-0-6),"Scientific foundations of global climate change, linkages between global climate change and impacts to
human health and their way of life, application of mitigation and adaptation strategies to minimize the
impacts of climate change on health and life.","แนวคิดทางวิทยาศาสตร์เกี􀃉ยวกับการเปลีย􀃉 นแปลงสภาพภูมิอากาศโลก การเชื􀃉อมโยงความสัมพันธ์ระหว่างการ
เปลีย􀃉 นแปลงสภาพภูมิอากาศโลกกับผลกระทบทีอ􀃉 าจเกิดขึ􀃊นต่อภาวะสุขภาพและวิถีชีวิตมนุษย์ การประยุกต์ใช้
กลยุทธ์ด้านการบรรเทาความรุนแรงของปัญหาและกลยุทธ์ด้านการปรับตัวต่อสภาพปัญหาเพือ􀃉 ลดผลกระทบจาก
การเปลีย􀃉 นแปลงสภาพภูมิอากาศโลกทีม􀃉 ีต่อภาวะสุขภาพ",,,
GE 2303,Building Brilliant Brain,การเสริมสร้างอัจฉริยภาพสมอง,General Education Courses,หมวดวิชาศึกษาทัวไป,Science and Mathematics Courses,กลุ่มวิชาวิทยาศาสตร์และคณิตศาสตร์,3 (3-0-6),"Scientific knowledge about daily living factors promoting brilliant brain function, applying neuroscience
research findings to brain healthy nutrition, fitness, attention adjustment and memory to improve
individual’s brain performance, creativity and success in everyday learning.","ความรู้ทางวิทยาศาสตร์เกี􀃉ยวกับปัจจัยในชีวิตประจำวันที􀃉ส่งเสริมการทำงานของสมองมนุษย์ การประยุกต์ใช้
ผลการวิจัยด้านประสาทวิทยา โภชนาการเพื􀃉อสุขภาพสมอง การบริหารสมอง การปรับความสนใจและความจำ
เพือ􀃉 ส่งเสริมศักยภาพของสมอง ความคิดสร้างสรรค์ และความสำเร็จในการเรียนรู้ในชีวิตประจำวัน",,,
MA 1200,Mathematics for Business,คณิตศาสตร์ธุรกิจ,General Education Courses,หมวดวิชาศึกษาทัวไป,Science and Mathematics Courses,กลุ่มวิชาวิทยาศาสตร์และคณิตศาสตร์,3 (3-0-6),"Relation and Various functions: linear, polynomial, exponential, logarithmic, rational and their applications
in business and economics, linear programming, mathematics of finance and differential calculus: limits,
derivatives, and optimization.","ความสัมพันธ์และฟังก์ชัน􀃉 ต่างๆ ซึ􀃉งประกอบด้วย ฟังก์ชัน􀃉 เชิงเส้น ฟังก์ชัน􀃉 พหุนาม ฟังก์ชัน􀃉 เอกซ์โพเนนเชียล
ฟังก์ชันลอการึทึม ฟังก์ชัน􀃉 ตรรกยะ และการประยุกต์ทางเศรษฐกิจ โปรแกรมเชิงเส้นเบื􀃊องต้น คณิตศาสตร์
การเงิน และแคลคูลัสซึง􀃉 ประกอบด้วย ลิมิต อนุพันธ์ ของฟังก์ชัน",,,
ACT 1601,Fundamentals of Financial Accounting,การบัญชีการเงินเบือ􀃊 งต้น,General Education Courses,หมวดวิชาศึกษาทัวไป,Science and Mathematics Courses,กลุ่มวิชาวิทยาศาสตร์และคณิตศาสตร์,3 (3-0-6),"Basic accounting theory and procedures for service and merchandising firms by using double-entry
system, completing accounting process: journalizing, posting to the ledgers, preparation of trial balance,
adjusting entries, worksheet and closing entries, as well as preparation and presentation of basic financial
statements.","ทฤษฎีพืน􀃊 ฐานและหลักการวิธีการบัญชีสำหรับกิจการซือ􀃊 ขายสินค้าและกิจการให้บริการ ตามหลักบัญชีคู่ การทำ
บัญชีอย่างครบถ้วนตามวงจรการบัญชี การบันทึกรายการในสมุดรายวัน การผ่านรายการไปยังบัญชีแยก
ประเภท จัดทำงบทดลอง การปรับปรุง จัดทำกระดาษทำการ การปิดบัญชี และการจัดทำและนำเสนองบการเงิน
พืน􀃊 ฐาน",,"For Arts Students, For Science & Technology Students","สำหรับนักศึกษาคณะศิลปศาสตร์,นักศึกษาคณะวิทยาศาสตร์และเทคโนโลยี"
CSX 1001,Basic Mathematics and Statistics,คณิตศาสตร์และสถิติพื􀃊นฐาน,General Education Courses,หมวดวิชาศึกษาทัวไป,Science and Mathematics Courses,กลุ่มวิชาวิทยาศาสตร์และคณิตศาสตร์,3 (3-0-6),"Basic foundation in mathematics and statistics such as real numbers and sets, algebra, linear equations
and inequalities, analytic geometry, functions, trigonometry, conic sections, matrix algebra, sequences
and series, data and statistics, and methods for summarizing and describing sets of data.","ความรู้พืน􀃊 ฐานด้านคณิตศาสตร์และสถิติ ได้แก่ ระบบจำนวนจริงและเซต พีชคณิต สมการเชิงเส้นและอสมการ
เรขาคณิตวิเคราะห์ ฟังก์ชัน􀃉 ตรีโกณมิติ ภาคตัดกรวย เมทริกซ์ อันดับและอนุกรม ข้อมูลและสถิติ วิธีการสรุป
ข้อมูลและการอธิบายลักษณะข้อมูล",,,
CSX 2002,Calculus,แคลคูลัส,Specialized Courses,หมวดวิชาเฉพาะด้าน,Core Courses,วิชาแกน,3 (3-1-7),"Rate of change, limits, finding limits and continuity, derivatives of function, chain rule, techniques of
differentiation and its application, L’Hopital’s rule. Integration, integration techniques and application of
integrals.","อัตราการเปลีย􀃉 นแปลง การหาค่าลิมิตและความต่อเนื􀃉อง อนุพันธ์ของฟังก์ชัน กฏลูกโซ่ เทคนิคการอนุพันธ์และ
การประยุกต์ของอนุพันธ์ กฏโลปิตาล การอินทิเกรต เทคนิคการอินทิเกรตและการประยุกต์",CSX 1001,,
CSX 2003,Principles of Statistics,หลักการสถิติ,Specialized Courses,หมวดวิชาเฉพาะด้าน,Core Courses,วิชาแกน,3 (3-1-7),"Basic probability theory, random variables, sampling distributions, statistical inference for one population
and two populations, Analysis of Variance, and analysis of categorical data.","พืน􀃊 ฐานทฤษฎีความน่าจะเป็น ตัวแปรสุ่ม การแจกแจงของค่าตัวอย่าง สถิติเชิงอนุมานสำหรับประชากร 1 กลุ่ม
และประชากร 2 กลุ่ม การวิเคราะห์ความแปรปรวน และการวิเคราะห์ข้อมูลเชิงกลุ่ม",CSX 1001,,
CSX 2004,UI/UX Design and Prototyping,การออกแบบและสร้างต้นแบบส่วนติดต่อและประสบการณ์ผู้ใช้งาน,Specialized Courses,หมวดวิชาเฉพาะด้าน,Core Courses,วิชาแกน,3 (3-0-6),"Overview of interactive systems, user capabilities, interface technology, design thinking process, user
stories and scenarios, wireframes and storyboards, prototyping, interaction design, usability design and
testing.","ภาพรวมของปฏิสัมพันธ์ระหว่างมนุษย์กับคอมพิวเตอร์ ความสามารถของผู้ใช้ เทคโนโลยีหน้าจอ ขัน􀃊 ตอน
กระบวนการคิดสำหรับการออกแบบ เนื􀃊อความและโครงเรื􀃉องของผู้ใช้ การวาดโครงร่างโปรแกรม และกำหนด
เนื􀃊อหา การสร้างแบบจำลอง แบบจำลองเสมือนจริง การออกแบบปฏิสัมพันธ์ การออกแบบและทดสอบ
ความสามารถในการใช้งาน",,,
CSX 2005,Design Thinking ,แนวคิดเชิงออกแบบ,Specialized Courses,หมวดวิชาเฉพาะด้าน,Core Courses,วิชาแกน,3 (3-0-6),"Overview of design process, problem interpretation, ideation, experimentation, solution discovery, design
thinking approach to develop products, services, or solutions for complex problems; design thinking
methodology, techniques, and supporting tools.","ภาพรวมของกระบวนการออกแบบ การตีความปัญหา กระบวนการคิด การทดลอง การค้นคว้าหาวิธีแก้ปัญหา
วิธีการคิดเชิงออกแบบเพื􀃉อพัฒนาผลิตภัณฑ์ บริการ หรือวิธีแก้ปัญหาที􀃉ซับซ้อน ระเบียบวิธีการ เทคนิค และ
เครื􀃉องมือสนับสนุนการคิดเชิงออกแบบ",,,
CSX 2006,Mathematics and Statistics for Data Science,คณิตศาสตร์และสถิติสำหรับวิทยาการข้อมูล 3,Specialized Courses,หมวดวิชาเฉพาะด้าน,Core Courses,วิชาแกน,3 (3-1-7),"Linear algebra such as vector spaces in n-space, inner product, norm and distance, orthogonal vector,
vector product, Orthogonal functions and Fourier series, including various techniques in multivariate data
analysis such as multiple regression analysis, discriminant analysis, logistic regression analysis, principal
component analysis, factor analysis, and cluster analysis.","พีชคณิตเชิงเส้น ได้แก่ ปริภูมิเวคเตอร์ใน n-มิติ ผลคูณภายใน นอร์มและระยะทาง เวคเตอร์ตัง􀃊 ฉาก ผลคูณเชิง
เวคเตอร์ ฟังก์ชันเชิงตัง􀃊 ฉากและอนุกรมฟูเรียร์ รวมทัง􀃊 เทคนิคต่างๆในการวิเคราะห์ข้อมูลหลายตัวแปรได้แก่
การวิเคราะห์ถดถอยพหุคูณ การวิเคราะห์จำแนกกลุ่ม การวิเคราะห์ถดถอยโลจิสติก การวิเคราะห์องค์ประกอบ
หลัก การวิเคราะห์องค์ประกอบ และการวิเคราะห์จัดกลุ่ม",CSX 2003,,
CSX 2007,Data Science,วิทยาการข้อมูล,Specialized Courses,หมวดวิชาเฉพาะด้าน,Core Courses,วิชาแกน,3 (3-0-6),"Comprehensive problem-solving mindset, principles, techniques and tools to deal with various facets of
data science practices including data preparation and visualization, exploration, description and prediction
required for knowledge extraction in both science and business domains.","การประมวลองค์ความรู้ในการแก้ปัญหา หลักการ กลวิธี และ เครื􀃉องมือต่างๆ เพือ􀃉 นำมาใช้ในการจัดการประเด็น
ปัญหาทีเ􀃉 กิดขึน􀃊 ตามแนวปฏิบัติของนักวิทยาศาสตร์ข้อมูล ทีป􀃉 ระกอบไปด้วย กระบวนการในการจัดเตรียมข้อมูล
และการทำให้มองเห็นภาพ กระบวนการสำรวจ กระบวนการอธิบายและการคาดการณ์ ซึ􀃉งเป็นที􀃉ต้องการในการ
สกัดองค์ความรู้ ทัง􀃊 ในด้านวิทยาศาสตร์ และธุรกิจ",CSX 2006,,
